{"componentChunkName":"component---src-templates-work-template-js","path":"/work/hiit-timer","result":{"data":{"allMdx":{"edges":[{"node":{"body":"function _extends() { _extends = Object.assign || function (target) { for (var i = 1; i < arguments.length; i++) { var source = arguments[i]; for (var key in source) { if (Object.prototype.hasOwnProperty.call(source, key)) { target[key] = source[key]; } } } return target; }; return _extends.apply(this, arguments); }\n\nfunction _objectWithoutProperties(source, excluded) { if (source == null) return {}; var target = _objectWithoutPropertiesLoose(source, excluded); var key, i; if (Object.getOwnPropertySymbols) { var sourceSymbolKeys = Object.getOwnPropertySymbols(source); for (i = 0; i < sourceSymbolKeys.length; i++) { key = sourceSymbolKeys[i]; if (excluded.indexOf(key) >= 0) continue; if (!Object.prototype.propertyIsEnumerable.call(source, key)) continue; target[key] = source[key]; } } return target; }\n\nfunction _objectWithoutPropertiesLoose(source, excluded) { if (source == null) return {}; var target = {}; var sourceKeys = Object.keys(source); var key, i; for (i = 0; i < sourceKeys.length; i++) { key = sourceKeys[i]; if (excluded.indexOf(key) >= 0) continue; target[key] = source[key]; } return target; }\n\n/* @jsxRuntime classic */\n\n/* @jsx mdx */\nvar _frontmatter = {\n  \"path\": \"/work/hiit-timer\",\n  \"title\": \"HIIT Timer\",\n  \"description\": \"Pushing my skills to make something I wanted to use at the time. I started to create this timer for myself and then realized there might be others who could use this. It's currently a work-in-progress.\",\n  \"tags\": [\"web development\", \"templating\", \"gulp\", \"email\"],\n  \"cover_image\": \"../../images/hiit-timer@2x.jpg\",\n  \"work_jumbo_title\": \"An idea to energize myself that could be helpful for others\",\n  \"laptop_image\": \"../../images/hiit-laptop-mock.png\",\n  \"role\": \"Designer/Developer\",\n  \"deliverable\": \"Hosted on Heroku\",\n  \"url\": \"https://hiit-timer-tp.herokuapp.com/\",\n  \"github\": \"https://github.com/vpugh/hiit-timer-react\",\n  \"client\": \"Self\",\n  \"draft\": false,\n  \"type\": \"work\",\n  \"date\": \"2018-01-03T00:00:00.000Z\"\n};\nvar layoutProps = {\n  _frontmatter: _frontmatter\n};\nvar MDXLayout = \"wrapper\";\nreturn function MDXContent(_ref) {\n  var components = _ref.components,\n      props = _objectWithoutProperties(_ref, [\"components\"]);\n\n  return mdx(MDXLayout, _extends({}, layoutProps, props, {\n    components: components,\n    mdxType: \"MDXLayout\"\n  }), mdx(\"p\", null, mdx(\"img\", {\n    parentName: \"p\",\n    \"src\": \"https://toripugh.com/images/gallery/hiit/current-state.jpg\",\n    \"alt\": \"alt\"\n  })), mdx(\"h3\", null, \"RECREATING TIMER IN REACT\"), mdx(\"p\", null, \"The simplest and most important part of the initial phase was just getting the timer to work at all. At the most basic I needed a timer that when hardcoded with an arbitrary time and content would cycle through and countdown.\"), mdx(\"p\", null, \"This required converting my Vue pomodoro timer into the base for this project in React. It was a little challenging, since React and Vue are different methodologies. Understanding the intent in each piece, I was slowly able to convert the functions and methods over into useful pieces.\"), mdx(\"p\", null, \"As a closing action on this first part, I changed the design so it wouldn't look exactly like the pomodoro timer. It would also serve a different purpose so I tried to think of a layout the would be helpful whether you were using your computer or phone. Somthing I wasn't concerned with while making the pomodoro timer.\"), mdx(\"h3\", null, \"INTEGRATING REDUX AND DYNAMIC DATA\"), mdx(\"p\", null, \"After getting the timer to work in general it was time to work on upgrades. I wanted to use Redux to simplify passing data all the way from the timer into the settings. This seeemd like the best way, at the time. Also, gave me a change to understand Redux more and test it in an environment were it could go wrong.\"), mdx(\"p\", null, \"Integrating Redux in the timer page was fairly straightforward and easy. Getting it to work properly in the settings page was another matter. That was a bit more of blood, sweat, and tears. I got the nested state to work correctly and getting updates to propagate to the timer was a fight. In the end, everything came together and worked.\"), mdx(\"h3\", null, \"FUTURE PARTS\"), mdx(\"p\", null, \"The next planned step is to create Redux action and reducers for creating a session. A session would be a collection of exercises that could be saved and can comeback to later. With the integration of sessions that would be leading into account setup and databases. If people were to start creating many different sessions, storing them would be the next big thing. Getting accounts setup, attaching DBs to them, and making sure the data stays put.\"), mdx(\"p\", null, \"An idea I'm working out in my mind was a suggestion. It would allow for a higher level of customiztion in regards to the sessions and their exercises. It would allow you immense customiztion in regards to the exact time of each exercise and rest period in a session. This sounds fairly complex so I look forward to testing it out in the near future.\"), mdx(\"p\", null, \"Further down the line, I would like to include a system for themeing the page. I can start with some premade colors I come up with. In the more distant future I could let people mess around and make whatever they want.\"), mdx(\"h3\", null));\n}\n;\nMDXContent.isMDXComponent = true;","frontmatter":{"title":"HIIT Timer","path":"/work/hiit-timer","work_jumbo_title":"An idea to energize myself that could be helpful for others","role":"Designer/Developer","deliverable":"Hosted on Heroku","client":"Self","laptop_image":"../../images/hiit-laptop-mock.png","github":"https://github.com/vpugh/hiit-timer-react","url":"https://hiit-timer-tp.herokuapp.com/"}}}]}},"pageContext":{}},"staticQueryHashes":[]}