{"componentChunkName":"component---src-templates-work-template-js","path":"/work/pomodoro-timer","result":{"data":{"allMdx":{"edges":[{"node":{"body":"function _extends() { _extends = Object.assign || function (target) { for (var i = 1; i < arguments.length; i++) { var source = arguments[i]; for (var key in source) { if (Object.prototype.hasOwnProperty.call(source, key)) { target[key] = source[key]; } } } return target; }; return _extends.apply(this, arguments); }\n\nfunction _objectWithoutProperties(source, excluded) { if (source == null) return {}; var target = _objectWithoutPropertiesLoose(source, excluded); var key, i; if (Object.getOwnPropertySymbols) { var sourceSymbolKeys = Object.getOwnPropertySymbols(source); for (i = 0; i < sourceSymbolKeys.length; i++) { key = sourceSymbolKeys[i]; if (excluded.indexOf(key) >= 0) continue; if (!Object.prototype.propertyIsEnumerable.call(source, key)) continue; target[key] = source[key]; } } return target; }\n\nfunction _objectWithoutPropertiesLoose(source, excluded) { if (source == null) return {}; var target = {}; var sourceKeys = Object.keys(source); var key, i; for (i = 0; i < sourceKeys.length; i++) { key = sourceKeys[i]; if (excluded.indexOf(key) >= 0) continue; target[key] = source[key]; } return target; }\n\n/* @jsxRuntime classic */\n\n/* @jsx mdx */\nvar _frontmatter = {\n  \"path\": \"/work/pomodoro-timer\",\n  \"title\": \"Pomodoro Timer\",\n  \"description\": \"A Github Pages hosted app that will replicate a pomodoro timer, in a more playful manner. Started off as a code challenge and then took some design liberties and used Vue to bring it to life.\",\n  \"tags\": [\"web development\", \"templating\", \"gulp\", \"email\"],\n  \"cover_image\": \"../../images/pomodoro@2x.jpg\",\n  \"work_jumbo_title\": \"A development challenge that turned into it's own app\",\n  \"laptop_image\": \"../../images/pomodoro-laptop-mock.png\",\n  \"role\": \"Designer/Developer\",\n  \"deliverable\": \"Github Pages Site\",\n  \"url\": \"https://vpugh.github.io/vue-pomodoro-timer/\",\n  \"github\": \"https://github.com/vpugh/vue-pomodoro-timer\",\n  \"client\": \"Self\",\n  \"draft\": false,\n  \"type\": \"work\",\n  \"date\": \"2018-01-03T00:00:00.000Z\"\n};\nvar layoutProps = {\n  _frontmatter: _frontmatter\n};\nvar MDXLayout = \"wrapper\";\nreturn function MDXContent(_ref) {\n  var components = _ref.components,\n      props = _objectWithoutProperties(_ref, [\"components\"]);\n\n  return mdx(MDXLayout, _extends({}, layoutProps, props, {\n    components: components,\n    mdxType: \"MDXLayout\"\n  }), mdx(\"p\", null, \"When I started making this timer for the challenge, I thought it would be no problem. How hard could a timer be to make? I ended up learning a lot and in the end building my own version from scratch using the Vue-CLI and then hosting it on Github Pages.\"), mdx(\"p\", null, \"Since it was such an involved process I wrote a blog article about my experience; my steps in creating; and the lessons I learned.\"), mdx(\"h3\", null, \"MINOR SETBACK\"), mdx(\"p\", null, \"I thought that creating a countdown system would be easy. It was anything but easy, at least for me who is weak in math. I had to go on a tangent of breaking down all the time into milliseconds and then using that as a base for keeping track of the overall time. I learned how all this worked by making a digital clock.\"), mdx(\"p\", null, \"After creating the clock I worked what I had learned into the countdown timer, which was pretty simple. I fulfilled the simple requests for the challenge - the Play button starts the timer; the Pause button stops the timer; and the Reset button returns the timer to its original state of 25 minutes.\"), mdx(\"p\", null, \"I'd done the challenge and had succeeded, where to go from here. I decided to dive in and make a fully functional pomodoro timer, one that counts from 25 mins to a 5 min break and repeats this a few times. This version needed to tell you what stage you were in, alert you when the stage was over and visually look a bit slicker.\"), mdx(\"h3\", null, \"MY POMODORO TIMER\"), mdx(\"p\", null, \"The design for this was purely tongue and cheek. Pomodoro is italian for tomato so it should be red. For the rest periods I thought it should be a 'green tomato' or 'tomatillo' and made the theme green. Something cute and different, a slight change of pace from just being red all the time.\"), mdx(\"p\", null, \"I have a display for what stage your in. This clearly has the 5 stages \\u2014 Timer, Rest, Timer, Rest, and Timer. It then tells you which stage your currently in and highlights the marker. I also fixed an issue with the original timer that it wouldn't clear the time between restarts. This caused it to gain speed on every restart and countdown into obliviion.\"), mdx(\"p\", null, \"I've also added sound effects to mark the change of the rounds. This was an interesting part for me as I'd never done anything with sounds embedded in anything. It adds that extra level of professionalism and helps if you've moved to another program or another tab.\"), mdx(\"p\", null, \"For this version I did not make the app in CodePen, I used the Vue CLI and exported it out and uploaded it to Github Pages. This was it's on mini adventure but luckily wasn't nearly as tough as I thought it would be.\"));\n}\n;\nMDXContent.isMDXComponent = true;","frontmatter":{"title":"Pomodoro Timer","path":"/work/pomodoro-timer","work_jumbo_title":"A development challenge that turned into it's own app","role":"Designer/Developer","deliverable":"Github Pages Site","client":"Self","laptop_image":"../../images/pomodoro-laptop-mock.png","github":"https://github.com/vpugh/vue-pomodoro-timer","url":"https://vpugh.github.io/vue-pomodoro-timer/"}}}]}},"pageContext":{}},"staticQueryHashes":[]}